Identificação de ataques de phishing através de machine learning;Bianca_Domingos_Guarizi;Bianca Domingos Guarizi, Dalbert Matos Mascarenhas
Instrumentos de Medição Seguros Baseados em Ambientes de Execução Confiáveis;EduardoValente;Eduardo Valente, Eduardo Machado, Gustavo Martins, Wilson Melo Jr.
Análise de Desempenho e Eficiência Energética dos Protocolos MQTT e CoAP no contexto de IoT;EmanuelFranceschiVieira;Emanuel de Franceschi Vieira, Murilo Cervi, Renato P. de Azevedo, Tiago A. Rizzetti
Avaliação da Eficiência de Protótipo de Jogo Educativo para o Ensino do Comportamento de Distinguir E-mails Legítimos de Tentativas de Phishing;JassonJunior;Jasson Júnior, Marcelo Henklain, Felipe Lobo, Eduardo Feitosa
Sistema Conteinerizado de Simulação para Algoritmos de Detecção de Ataques em Redes Definidas por Software;MatheusPivetta;Matheus B. Pivetta, Thiago dos S. Cavali, Keiko V. O. Fonseca, Mauro Sergio P. Fonseca
Plataforma Blockchain para Monetização de Dados Veiculares visando Eficiência Energética;StephanieSilva;Stephanie Silva, Victor Silva, Malkai Oliveira, Wilson Melo Jr.
Aplicação da Técnica Fuzzing em Testes da Implementação de Referência do SPDM;ThiagoFerreira;Thiago D. Ferreira, Renan C. A. Alves, Bruno C. Albertini, Marcos A. Simplicio Jr., Daniel M. Batista
