Menção honrosa,SF_Certificado_Mencao_EXSS.pdf,"EXSS: Um Emulador Educativo de Ataques Cross-Site Scripting
Bianca Guarizi (CEFET-RJ), Isabela Alves (CEFET-RJ), Júlia Souza (CEFET-RJ), Guilherme Pimentel (UFF), João Watanabe (UFF), Dalbert Mascarenhas (CEFET-RJ), Ian Vilar Bastos (UERJ), Marcelo Rubinstein (UERJ), Igor Moraes (UFF)"
Menção honrosa,SF_Certificado_Mencao_Web.pdf,"Web xKaliBurr: uma Plataforma Online para Levantamento de Informações em Pentest em Aplicações na Internet 
Daniel de Barros (UFC), Lucas Cabral (UFC), João Alves de Oliveira (UFC), Felipe Castro (UFC), Lucas Soares (UFC), Lincoln Rocha (UFC), José Maria Silva Monteiro Filho (UFC), Joaquim Cavalcante-Neto (UFC)"
Melhor artigo,SF_Certificado_Melhor_MH_FSF.pdf,"MH-FSF: um Framework para Reprodução, Experimentação e Avaliação de Métodos de Seleção de Características
Vanderson Rocha (UFAM), Hendrio Luis Bragança (UFAM), Diego Kreutz (UNIPAMPA), Eduardo Feitosa (UFAM)"
